timestamp,case_id,session_id,text_input,mri_description,image_name,image_size_bytes,case_summary,safe_insights,hospitals_count,tools_used,disclaimer
2026-04-24T11:49:31.695460+00:00,CASE-25C95B3A7B,session-yqw999y9,aadaaf,,,0,Primary symptoms: aadaaf,"Symptoms should be clinically correlated with exam findings and formal radiology review. | Track symptom onset, progression, and any neurological changes for your clinician.",0,csv_storage_tool,This is not a medical diagnosis. Consult a doctor.
2026-04-24T11:49:55.822270+00:00,CASE-C3F3086D38,session-yqw999y9,"headache,nausea
",,,0,"Primary symptoms: headache,nausea","Persistent headache is a red-flag symptom if worsening, severe, or paired with confusion. | Severe nausea with neurological symptoms can indicate increased intracranial pressure. | Track symptom onset, progression, and any neurological changes for your clinician.",0,csv_storage_tool,This is not a medical diagnosis. Consult a doctor.
2026-04-24T11:50:10.557417+00:00,CASE-539D982870,session-yqw999y9,"headache,nausea, vomit, flu
",,,0,"Primary symptoms: headache,nausea, vomit, flu","Persistent headache is a red-flag symptom if worsening, severe, or paired with confusion. | Severe nausea with neurological symptoms can indicate increased intracranial pressure. | Repeated vomiting with neuro symptoms merits urgent medical review. | Track symptom onset, progression, and any neurological changes for your clinician.",0,csv_storage_tool,This is not a medical diagnosis. Consult a doctor.
